{
  "accounting_mode": "full",
  "algorithm_family": "hhl",
  "classical_ref": {
    "algorithm_label": "Black-Scholes closed form (50k iter for wall-clock floor)",
    "metric_value": 18.02295145021668,
    "source": "v3 stretch: derivative-pricing classical baseline",
    "wall_clock_seconds": 0.015615917000104673
  },
  "epsilon": 1e-06,
  "experiment_id": "exp_5",
  "hardware_profile": "ti_e4_surface",
  "instance": {
    "instance_id": "SD3_v6_proxy_v1",
    "parameters": {
      "ham_sim_steps": 1,
      "n_b": 5,
      "n_clock": 3,
      "n_shots": 4096,
      "random_seed": 0,
      "task": "HHL template proxy"
    }
  },
  "label": "SD3",
  "measured": {
    "inferred_from": "SD3_ti_e4_surface_eps1e-06_bare.json",
    "logical_qubits": null,
    "physical_qubits": null,
    "reason": "inferred_timeout_from_bare (timeout_after_7200s)",
    "runtime_seconds": null,
    "status": "engine_failure",
    "t_count": null,
    "t_depth": null,
    "wall_clock_seconds": 0.0
  },
  "method_implementation": {
    "name": "SD3_HHL-template-proxy",
    "qdk_version": "1.27.0",
    "qiskit_version": "2.3.0",
    "source_path": "p4_experiments/experiments/silos/derivative_pricing/1bf880322e6f__exp_5/circuit.py"
  },
  "metric": {
    "ci_high": null,
    "ci_low": null,
    "n_shots": null,
    "name": null,
    "status": "bare_only_metric_design",
    "value": null
  },
  "paper_claimed": {
    "circuit_depth": null,
    "claimed_speedup": "theoretical",
    "num_qubits": null,
    "runtime_seconds": null,
    "t_count": null,
    "t_depth": null
  },
  "paper_id": "1bf880322e6f",
  "provenance": {
    "created_utc": "2026-04-25T10:15:29.370999+00:00",
    "git_commit": "unknown",
    "operator": "p4_runner",
    "preregistration_tag": "s2-quantitative-canonical",
    "qdk_version": "1.27.0",
    "qiskit_version": "2.3.0"
  },
  "schema_version": "1.0",
  "silo": "derivative-pricing",
  "unit_id": "e1611d2b30150fba"
}